"N˙mero Contrato";"CÛdigo ”rg„o Superior";"Nome ”rg„o Superior";"CÛdigo ”rg„o";"Nome ”rg„o";"CÛdigo UG";"Nome UG";"N˙mero Apostilamento";"DescriÁ„o Apostilamento";"Valor Apostilamento";"Data de inclus„o";"SituaÁ„o Apostilamento"
"122017";"25000";"MINISTERIO DA ECONOMIA";"25000";"MINISTERIO DA ECONOMIA";"170078";"SUP.REGIONAL RECEITA FEDERAL 5A.RF/BA";"00000000000012018";"REPACTUAÁ„O EFETUADA.";"42051,60";"20/02/2018";"Encerrado"
"22017";"25000";"MINISTERIO DA ECONOMIA";"25000";"MINISTERIO DA ECONOMIA";"170145";"DELEGACIA DA REC.FEDERAL EM LIMEIRA/SP";"000000000002/2018";"Reajuste do ano de 2017";"104431,40";"23/04/2018";"Encerrado"
"22017";"25000";"MINISTERIO DA ECONOMIA";"25000";"MINISTERIO DA ECONOMIA";"170145";"DELEGACIA DA REC.FEDERAL EM LIMEIRA/SP";"000000000001/2018";"REAJUSTE RELATIVO AO ANO DE 2016";"127630,20";"23/04/2018";"Encerrado"
"52017";"25000";"MINISTERIO DA ECONOMIA";"25000";"MINISTERIO DA ECONOMIA";"170177";"SUP.REGIONAL RECEITA FEDERAL 10A.RF/RS";"00000000000000001";"2018NE800232";"0,00";"09/04/2018";"Encerrado"
"62017";"25000";"MINISTERIO DA ECONOMIA";"25000";"MINISTERIO DA ECONOMIA";"170177";"SUP.REGIONAL RECEITA FEDERAL 10A.RF/RS";"00000000000000001";"2018NE800005";"0,00";"28/02/2018";"Encerrado"
"42017";"25000";"MINISTERIO DA ECONOMIA";"25000";"MINISTERIO DA ECONOMIA";"170314";"MF - SRF - DELEGACIA DA REC. FED. BLUMENAU/SC";"00000000000012018";"REPACTUAÁ„O 2018.";"1652,50";"24/05/2018";"Encerrado"
"152017";"20113";"MINISTERIO DO PLANEJAMENTO,DESENV. E GEST√O";"25205";"FUND.INST.BRASILEIRO DE GEOG.E ESTATISTICA";"114625";"UNIDADE ESTADUAL DO IBGE NO RIO GRANDE DO SUL";"00000000000012018";"REPACTUAÁ„O POR CCT 2018 E AUMENTO NO VALOR DAS PASSAGENS.";"2341,00";"23/05/2018";"Efetivado"
"222017";"26000";"MINISTERIO DA EDUCACAO";"26236";"UNIVERSIDADE FEDERAL FLUMINENSE";"153057";"HOSPITAL UNIVERSIT.ANTONIO PEDRO DA UFF/RJ";"000000000001/2018";"Leia-se:'6.1. As faturas ou notas fiscais referentes aos serviÁos contratados terao que ser apresentados em ate 5(cinco) das posteriores ao mes de exe                                                        cuÁ„o dos serviÁos'";"0,00";"16/03/2018";"Encerrado"
"332017";"26000";"MINISTERIO DA EDUCACAO";"26261";"UNIVERSIDADE FEDERAL DE ITAJUBA";"153030";"UNIVERSIDADE FEDERAL DE ITAJUBA/MG";"000000000002/2018";"Apostilamento decorrente de homologaÁ„o de ConvenÁ„o Coletiva de Trabalho 2                                                                       018.";"17513,70";"19/06/2018";"Encerrado"
"212017";"26000";"MINISTERIO DA EDUCACAO";"26350";"FUNDACAO UNIVERSIDADE FED. DA GRANDE DOURADOS";"150248";"HOSPITAL UNIVERSIT¡RIO";"00000000000000001";"Acrescentar em R$ 95.202,03 (noventa e cinco mil, duzentos e dois reais e trÍs centavos) refetentes ‡ repactuaÁ„o dos custos da m„o de obra para os meses de janeiro a dezembro de 2018, aferido pela CCT 2018/2018, conforme cl·                                                  usula dÈcima do contrato.";"95202,00";"12/06/2018";"Encerrado"
"232017";"26000";"MINISTERIO DA EDUCACAO";"26350";"FUNDACAO UNIVERSIDADE FED. DA GRANDE DOURADOS";"150248";"HOSPITAL UNIVERSIT¡RIO";"000000000001/2018";"RepactuaÁ„o de valores em virtude de CCT2018.";"11969,30";"09/04/2018";"Encerrado"
"392017";"26000";"MINISTERIO DA EDUCACAO";"26405";"INST.FED.DE EDUC.,CIENC.E TEC.DO CEAR¡";"158133";"INST.FED.DE EDUC., CIENC. E TEC.DO CEAR¡";"000000000001/2018";"CCT 2018/2018 COM N˙MERO DE REGISTRO MTE CE000321/2018.";"9003,30";"23/07/2018";"Encerrado"
"32017";"26000";"MINISTERIO DA EDUCACAO";"26442";"UNIV.DA INTEF.INTERN.DA LUSOF.AFRO-BRASILEIRA";"158634";"UNILAB - CAMPUS DOS MAL S";"00000000000000002";"AÁ„o complementar ao 1 apostilamento de 23/04/2018 uma vez que este n„o abr                        angia todo o perÌodo o qual a empresa fazia direito";"25669,00";"12/07/2018";"Encerrado"
"32017";"26000";"MINISTERIO DA EDUCACAO";"26442";"UNIV.DA INTEF.INTERN.DA LUSOF.AFRO-BRASILEIRA";"158634";"UNILAB - CAMPUS DOS MAL S";"00000000000000001";"REPACTUAÁ„O DOS VALORES ACORDADOS NO CONTRATO 03/2017, PRESTAÁ„O DE SERVIÁO DE LIMPEZA E CONSERVAÁ„O PREDIAL NO CAMPUS DOS MALÍS, COM BASE NA VARIAÁ„ODOS CUSTOS DE M„O DE OBRA CONFORME CL·USULA SEXTA DO EDITAL E CCT 2017/2018                                                              SINDLIMP/SEAC";"58338,40";"20/03/2018";"Encerrado"
"392017";"37000";"CONTROLADORIA GERAL DA UNI√O";"37000";"CONTROLADORIA GERAL DA UNI√O";"370003";"COORD. GERAL, DE LIC. CONT. E DOC/DGI/SE/CGU";"000000000001/2018";"REAJUSTE DE PREÁOS DO CONTRATO N  39/2017, FIRMADO COM A EMPRESA ENGEMIL ENGENHARIA E EMPREENDIMENTOS, MANUTENÁ„O E INSTALAÁıES LTDA, CUJO OBJETO ÈA CONTRATAÁ„O DIRETA DE EMPRESA REMANESCENTE DO PREG„O ELETRÙNICO N∫21/2015 ESPECIALIZADA, NO RAMO DA ENGENHARIA CONSTRUTIVA, PARA EXECUÁ„O DO PROJETODE ADAPTAÁ„O DOS SANIT·RIOS COLETIVOS DO EDIFÌCIO DARCY RIBEIRO,TOTALIZANDO";"108188,50";"26/06/2018";"Encerrado"
"222017";"39000";"MINISTERIO DOS TRANSPORTES";"39253";"EMPRESA DE PLANEJAMENTO E LOGÕSTICA S.A - EPL";"395001";"EMPRESA DE PLANEJAMENTO E LOGÕSTICA S.A - EPL";"00000000000000001";"RepactuaÁ„o contratual.";"35534,40";"04/07/2018";"Encerrado"
"142017";"52000";"MINISTERIO DEFESA";"52121";"COMANDO DO EXERCITO";"160089";"SECRETARIA DE ECONOMIA E FINANCAS-MEX/DF";"000000000001/2017";"CORREÁ„O DO VALOR COM O ACRÈSCIMO DA DIFERENÁA PARA A PRESTAÁ„O DOS SERVIÁOS POR MAIS 11 (ONZE) MESES, TENDO EM VISTA O VALOR DA LICITAÁ„O FOI CADASTRADRO COM O VALOR MENSAL NO SIASG, E N„O O ANUAL, COM O VALOR UNIT·RIO DE ACESSO COM R$ 1.081,00, PARA 3 (TRÍS) LICENÁAS DE ACESSO, O VALOR MENSAL SOMA  R$3.243,00, INVIABILIZANDO A PUBLICAÁ„O E APROPRIANÁ„O DO CONTRATO PELO S";"35673,00";"13/12/2017";"Encerrado"
